"AwardNumber","Title","NSFOrganization","Program(s)","StartDate","LastAmendmentDate","PrincipalInvestigator","State","Organization","AwardInstrument","ProgramManager","EndDate","AwardedAmountToDate","Co-PIName(s)","PIEmailAddress","OrganizationStreet","OrganizationCity","OrganizationState","OrganizationZip","OrganizationPhone","NSFDirectorate","ProgramElementCode(s)","ProgramReferenceCode(s)","ARRAAmount","Abstract"
"1566393","EAGER: Open XD Metrics on Demand Value Analytics","OAC","XD-Extreme Digital","04/01/2016","01/27/2016","Matthew Link","IN","Indiana University","Standard Grant","Edward Walker","03/31/2018","$296,416.00","Thomas Furlani, Katy Borner, Steven Gallo, Robert Henschel","mrlink@iu.edu","107 S INDIANA AVE","BLOOMINGTON","IN","474057000","3172783473","CSE","747600","7916","$0.00","Understanding the value of campus-based cyberinfrastructure (CI) to the institutions that invest in such CI is intrinsically difficult.  Given today's financial pressure, administrative support for campus-based CI centers offering resources to local campus users is under constant budgetary pressure.  This is partly due to the difficulty in obtaining quantitative metrics that clearly demonstrate the utility of investment in campus CI centers in enhancing scientific research and the financial aspects of enhanced competitive ability in seeking funding for research.  <br/><br/>This proposal seeks to implement a set of highly experimental modules to be added to the existing CI metrics tool eXtreme Data Metrics on Demand (XDMoD).  These modules are intended to provide a means for assessing campus-based CI investment in scientific terms, as measured in publications, and in financial terms, as measured in grant income from researchers who use CI as compared to those who do not.  The modules, tentatively called Open XDMoD Value Analytics, will present a view of financial, collaboration, and publication data, showing ""return-on-investment"" metrics in relation to CI usage.  The goal of the work is to generalize these modules to work with a variety of funding and publication information sources, and incorporate them into the open source distribution of Open XDMoD."
"1558343","Characterizing Current and Wave Drag over Shallow Coral Reefs","OCE","PHYSICAL OCEANOGRAPHY","04/01/2016","01/28/2016","Steven Lentz","MA","Woods Hole Oceanographic Institution","Standard Grant","Baris Uz","03/31/2018","$382,006.00","","slentz@whoi.edu","266 WOODS HOLE RD","WOODS HOLE","MA","025431535","5082893542","GEO","161000","","$0.00","The defining hydrodynamic characteristic of coral reefs is that they are rough. Consequently, the fundamental challenge in understanding and modeling the dynamics of both currents and surface gravity waves over shallow coral reefs is characterizing drag. This research is aimed at developing more accurate circulation and wave models for coral reefs that are essential for properly interpreting observations and modeling biochemical processes over reefs. A better understanding of the hydrodynamics is also essential for making accurate assessments of the impact of climate change on coral reefs. For example, the dependence of drag coefficients on water depth clearly has implications to the impact of sea level rise on coral reefs. This study will directly benefit ongoing research on the impact of ocean acidification on the barrier reefs of Palau (western tropical Pacific) and Dongsha (South China Sea) by providing a better physical context for interpreting biochemical observations. The project will inform the thesis work of two graduate students. <br/><br/>To advance the understanding of current and wave drag over coral reefs, this study addresses four sets of questions: 1) Do drag coefficients based on depth-average currents depend on water depth in a manner consistent with theory from open-channel flow and does this dependence account for some of the scatter in coral reef drag coefficients? 2) What is the relationship between surface gravity wave friction factors over coral reefs and orbital displacements and is it consistent with results from laboratory studies and existing theories? 3) Do wave-current interactions significantly enhance current drag and wave dissipation over coral reefs? 4) Are hydrodynamic roughness estimates for currents and surface waves similar and what is their relationship to physical roughness over coral reefs?  These four sets of questions will be addressed use existing observations of current profiles, pressures, and wave characteristics from three very different coral reef systems, Palau's barrier reef, Dongsha Atoll, and three platform reefs in the Red Sea. Spatial-average drag coefficients will be estimated by integrating the momentum balance across the reefs to account for spatial (and temporal) variations in water depth and determining the drag coefficient that minimizes the residual error in the momentum balance. Wave friction factors will be estimated by integrating the wave-energy balance across the reef and minimizing the residual error.  Since there are substantial spatial and temporal variations in water depth over coral reefs determining the drag coefficient dependence on water depth and providing a model for that dependence will be a significant advance in the understanding of coral reef hydrodynamics. The project will advance the understanding of wave-current interactions over coral reefs, a potentially important unresolved problem. Accounting for these factors influencing current and wave drag will allow accurate and consistent estimates of hydrodynamic roughness that can then be related to coral reef physical roughness."
"1560093","REU Site: Physics and Chemistry Research at The College of Wooster","DMR","XC-Crosscutting Activities Pro","04/01/2016","01/27/2016","John Lindner","OH","College of Wooster","Standard Grant","Lynnette Madsen","03/31/2019","$287,892.00","Susan Lehman","jlindner@wooster.edu","1101 N BEVER ST","WOOSTER","OH","44691","3302632293","MPS","722200","1711, 7222, 9178, 9250","$0.00","NON-TECHNICAL DESCRIPTION: <br/>The purpose of the Wooster REU site is to enable undergraduates and faculty to work closely together on original, publishable research involving a broad range of materials science, physics, and chemistry projects. Wooster is a liberal arts college long recognized for its mentored undergraduate research. The faculty have designed on-going research programs that are both innovative and accessible to undergraduates. Dedicated and individualized mentoring in the tools, techniques, and process of research trains and inspires young students to persist in science while contributing to publishable research. The site specifically targets beginning students, often having completed just one year of college, and often from institutions where research opportunities are scarce; it encourages the full participation of women and underrepresented groups by providing a vibrant supportive environment, and it has partnered with nearby two-year colleges to recruit students who might otherwise not major in a science or even complete college. Each student takes ownership of an individual project, conducts original research, and becomes a practicing scientist through the research project, oral and poster presentations, and written reports.<br/><br/>TECHNICAL DESCRIPTION: <br/>The purpose of the Wooster REU site is to provide an environment for young students to learn the tools and techniques of scientific research while working closely with a faculty mentor on exciting and publishable research projects. The research spans a broad range of fields including condensed matter, granular materials, nanowires, spatiotemporal pattern formation, light-emitting polymers, quantum optics, nonlinear dynamics, and astrophysics. It uses experimental, computational, and theoretical techniques. Highlights include controlling spatio-temporal dynamics with noise and disorder, experimentally realizing arrays of one-way coupled oscillators, and understanding granular flows using bead piles. Research projects are intentionally designed so that even novice undergraduates can make significant scientific contributions. Past summer research has contributed to 32 scientific papers involving 54 undergraduate coauthors in journals such as Physical Review. Results have been featured twice on the cover of the American Journal of Physics and in news stories in Physical Review Focus and Nature News. Student researchers are trained in research skills including critical thinking, data analysis, and scientific writing."
"1600220","Conference on Advances in Geometric Representation Theory","DMS","ALGEBRA,NUMBER THEORY,AND COM","03/01/2016","01/22/2016","Sarah Kitchen","MI","Regents of the University of Michigan - Ann Arbor","Standard Grant","James Matthew Douglass","02/28/2017","$35,000.00","Thomas Nevins","snkitche@mtu.edu","1109 GEDDES AVE STE 3300","ANN ARBOR","MI","481091015","7347636438","MPS","126400","7556","$0.00","The conference ""Advances in geometric representation theory"" will be held May 8-13, 2016 at the University of Michigan. Geometric representation theory is the study of symmetry via geometric spaces. It is an expanding branch of mathematics with wide-reaching applications and connections to other fields. The timing of the conference has been chosen in anticipation of the first results emerging from the 2014 program in geometric representation theory at the Mathematical Sciences Research Institute in Berkeley, as well as intensive semester programs in Canada and Sweden. The conference will provide a venue to disseminate major new results in this rapidly developing field of mathematics and make the corresponding new methods and points of view available to a broad range of researchers. In particular, the organizers will make specific efforts to include graduate students and post-docs, as well as members of underrepresented groups.<br/><br/>Classically, problems of classification of representations have been attacked with a wide variety of algebraic, analytic, and combinatorial methods. Since the more recent discovery of equivalences with geometric objects such as D-modules, the door has been opened to the application of powerful tools from geometry, such as Hodge theory and the decomposition theorem. The conference will focus on these recent developments. New categorical techniques and relationships to physics and algebraic geometry will draw the participation of researchers from those fields, which will contribute to further interdisciplinary interactions. The conference website is  http://www-personal.umich.edu/~snkitche/Conference/."
"1555790","Collaborative Research: An integrative approach to understanding the evolution and systematics of Chalcidoidea: A recent megaradiation of Hymenoptera","DEB","Biodiversity: Discov &Analysis","03/01/2016","01/21/2016","James Woolley","TX","Texas A&M AgriLife Research","Standard Grant","Katharina Dittmar","02/28/2021","$89,364.00","","jimwoolley@tamu.edu","2147 TAMU","COLLEGE STATION","TX","778430001","9798626777","BIO","119800","9169, 9178, 9251, EGCH, SMET","$0.00","Chalcidoidea (jewel wasps) are among the most species rich, ecologically important, and biologically diverse groups of terrestrial organisms. Their diversity is staggering, with more than 500,000 species thought to exist. These minute wasps (mostly 1-2 mm in size) are numerically abundant and common in almost every habitat. The smallest of these wasps are smaller than a typical single-celled organism, and yet the adults can fly, locate their hosts, deposit their eggs, and as larvae, consume their insect hosts. Most chalcidoid wasps are parasitoids; they feed on their insect hosts, eventually killing them. A few groups have also evolved to attack plant hosts and some serve as pollinators. Species attack all life stages from eggs to adults, and live and feed either internally or externally. Some are parasitoids of other parasitoids and some may even feed on their own species. Because they kill other insects, these wasps are extremely important for the control of pests of agricultural and forest crops, as well as vectors of human disease and veterinary pests. The economic importance of these wasps in pest management is unparalleled. They are widely used in biological control programs against major pests, with outcomes documented to result in decreases in pesticide, increases in yield, and in landmark cases direct savings of billions of dollars or permanent pest control. The evolutionary events leading to this enormous diversity in morphology, biology and rates of diversification are poorly understood, leading to an artificial system of taxonomic classification. In this research project, researchers will use a diverse array of molecular, morphological and bioinformatics approaches to develop a solid understanding of the hierarchy of relationships across the entire group. These relationships will then be used to reclassify major groups to reflect common ancestry, to provide a framework for a web-accessible portal to manage and deliver information on their diverse biology, and to explore the evolutionary changes that have driven and shaped this enormous radiation of terrestrial insects.<br/><br/>The objectives of the research project are to 1) generate a robust molecular phylogeny of the Chalcidoidea using new data from transcriptomes and targeted DNA enrichment for over 400 species, 2) generate morphological data for over 200 fossils from Eocene and Cretaceous amber and combine these with a comprehensive morphological data set for extant taxa, 3) develop a revised classification of Chalcidoidea in book form through a series of workshops and worldwide collaborations, and 4) make available information on the taxonomy, biology and distribution of over 31,000 available names and information in over 40,000 references. The project will train two postdoctoral researchers, one graduate student and several undergraduates. To involve the wider scientific community, a worldwide group of biocontrol researchers and taxonomists will develop a new classification for Chalcidoidea. With groups of Research and Extension Specialists, the project will develop posters, fliers, specimen education kits, and other educational materials for use in the classroom and by extension specialists, agricultural advisors, master naturalists  and master gardeners, and the general public to develop a greater interest and understanding of this charismatic and and important group of insects."
"1554720","CAREER: Scalable MIMO Spatial Filtering and Synchronization for Heterogenous Wireless Networks","ECCS","CCSS-Comms Circuits & Sens Sys","03/01/2016","06/16/2021","Arun Natarajan","OR","Oregon State University","Standard Grant","Jenshan Lin","02/28/2022","$500,000.00","","arun.natarajan@oregonstate.edu","1500 SW JEFFERSON AVE","CORVALLIS","OR","973318655","5417374933","ENG","756400","096E, 1045","$0.00","Wireless networks are an integral part of the information infrastructure and are more widespread than even access to electricity in some parts of the world. The primary challenge for next-generation wireless networks is data capacity. Wireless data usage is doubling every year and network providers are projecting demand approaching one gigabit per user per day. This requires a 1000x increase in network capacity and 100x increase in worst-case data rates. Since availability of spectrum is limited, the higher capacity must be achieved by sharing existing spectrum among users and improving the performance of wireless systems. However, mobile applications also require low power consumption for longer battery life.  This project will investigate energy-efficient wireless circuits and systems for next-generation wireless networks that can provide gigabit per second links while operating under dense spectrum reuse. Developing such wireless systems has broad impact since improving the availability and speed of wireless links will expand existing applications as well as enable new applications that benefit economy and society. Synergy between education and research includes the creation of an inter-disciplinary course on multiple-input multiple-output (MIMO) communications. This will allow students to identify and solve high-impact cross-domain problems in wireless networks. Outreach to high school students will create opportunities for early exposure to research environments, strengthening STEM pipelines.<br/><br/>Next-generation wireless networks will be based on MIMO systems for increased capacity in the context of spectrum scarcity and extreme densification. This project investigates MIMO circuits and architectures to achieve interference cancellation and enable next-generation, high-capacity wireless networks. The increasing speed of CMOS transistors and near-zero incremental cost of additional transistors allow the development of novel integrated architectures that leverage multiple transmit-receive elements to achieve higher performance and interferer tolerance. Ensuring the scalability of such architectures in terms of energy-efficiency and performance is critical as next-generation networks transition to larger number of elements and higher performance. This project will also study circuits and architectures for simplifying synchronization between elements in large-scale MIMO arrays. Using multiple elements to improve transceiver frontend performance results in relaxed analog-to-digital converter requirements, thereby enabling digital-intensive architectures that further support scalability."
"1554171","CAREER: Computational toolbox for improved security of power systems","ECCS","EPCN-Energy-Power-Ctrl-Netwrks","03/01/2016","01/21/2016","Konstantin Turitsyn","MA","Massachusetts Institute of Technology","Standard Grant","Lawrence Goldberg","02/28/2021","$500,000.00","","turitsyn@mit.edu","77 MASSACHUSETTS AVE","CAMBRIDGE","MA","021394301","6172531000","ENG","760700","1045, 155E","$0.00","The power grid is undergoing probably the most transformative transition in the last 50 years. Introduction of clean, but intermittent (sporadic) renewable generation introduces an unprecedented level of uncertainty in power system operation. At the same time, the society becomes more and more dependent on reliable supply of power and more sensitive to power outages. Maintaining power system security i.e. its ability to withstand most probable disturbances is an extremely challenging computational problem. Millions of scenarios have to be fast screened by operators and contingency plans prepared for the most dangerous of them. The key objective of this project is to develop a new generation of computational techniques that would allow fast identification of safe operating conditions that ensure system resiliency. This goal is achieved by targeted advancement and adaptation of the modern optimization and nonlinear analysis techniques to specific challenges faced by the power industry. The latter include but are not limited to: estimation of the reserve levels necessary for operation in the presence of intermittent wind power, identification of the most dangerous line failure scenarios, design of the most effective remedial action plans. The research activities will be tightly interwoven with educational and outreach efforts. Undergraduate and high-school students from underrepresented minorities will be engaged in the group research and educational activities. A set of simple power-grid inspired puzzles will be developed that will help explaining the kids and the broad audience the technical trade-offs and decisions that the power industry faces today. Finally, a new EdX introductory class on power systems with interactive problems will be developed to help in educating the future engineering workforce for power industry.<br/><br/>The technical approach of the research part of the project is based on the idea of constructing safe operation regions in parameter space where the solution is guaranteed to exist and satisfy operational constraints. These ""certificates"" are formally an inner approximation of the feasibility set and can be constructed via a variety of techniques with the most general relying on Sum-of-Squares approaches. The project will explore possible representations of the mathematical problems appearing in the context of power system operations and security assessment. Specific problems that will be naturally addressed with the developed mathematical tools include computation of do-not-exceed limits, screening of N-1 and N-2 contingencies for AC power flow model, verification of the remedial actions, assessment of voltage stability margins in the presence of distributed reactive power control. A hierarchy of certificates will be constructed covering the conservativeness - complexity trade-off curve and their effectiveness demonstrated on standard IEEE testcases. The implementations of the codes will be linked to the mostpopular academic analysis packages and release under open source license in public domain."
"1557841","Collaborative Research: Experimental Evolution of Peptidoglycan in the Bacterial Symbiont Vibrio Fischeri","IOS","Symbiosis Infection & Immunity","03/01/2016","02/14/2018","David Popham","VA","Virginia Polytechnic Institute and State University","Continuing Grant","Mamta Rawat","02/29/2020","$165,549.00","","dpopham@vt.edu","300 TURNER ST NW","BLACKSBURG","VA","240603359","5402315281","BIO","765600","9178, 9179","$0.00","Bacterial cell walls are usually composed of an interconnected mesh made of peptidoglycan (PG). PG is unique to these microorganisms. It is essential for bacterial survival, and has a remarkably conserved structure throughout diverse bacterial groups. PG is not found in plants and animals, and given its essentialness and conservation in bacteria, it is an excellent target for antibiotics and innate immunity. Thus, PG is a focus of strategies for bacterial detection and control. Blocking the ability of bacteria to make a normal PG structure is generally lethal, yet in rare instances bacteria with novel PG have evolved naturally. This project uses the model animal-associated bacterium Vibrio fischeri to explore what happens when PG is experimentally forced to evolve. The results will shed light on the natural evolution of peptidoglycan, on the constraints of its function in bacteria, and on the limits of targeting PG as a means of controlling bacteria. Moreover, V. fischeri is a natural symbiotic bacterium that colonizes a Hawaiian squid, and PG is a key signaling molecule in this symbiosis. Thus, it offers the opportunity to examine how peptidoglycan structure affects the ability of host animal tissue to detect and respond to its resident bacteria (i.e., its microbiome). The broader impacts of this work for society include interdisciplinary graduate and undergraduate student training, outreach to community K-12 schools, and contributions to a book on bacterial symbionts geared for use in the classroom. <br/><br/>This project will elucidate how unusual changes to bacterial cell-wall peptidoglycan (PG) structure can evolve, and it will help define constraints on PG evolution. This project will examine how the tractable bacterium Vibrio fischeri can evolve new PG structure(s) using a strategy of iteratively blocking both normal and alternative pathways to PG biosynthesis. Viable mutants generating novel PG will be selected. Such mutants are likely to have distinctly non-wild-type properties of growth, cell shape, motility, etc.; however, rounds of growth in culture will lead to evolved strains that have accommodated the new PG. A combination of phenotypic testing and whole-genome resequencing will underpin a systems-type analysis of these evolved strains. The integrated analysis of genetic and phenotypic data will improve our understanding of how the cell wall is coordinated with other cellular components and processes, and it will lead to the discovery of new phenotypically important interconnections in bacterial cells. The results will inform our understanding of the natural evolution of PG and lead to a more predictive understanding of how PG might evolve in the future, e.g. under selective pressure from antibiotic use. V. fischeri is a symbiont in a model squid symbiosis, in which symbiont PG triggers developmental changes in the host. This study will provide insight into the relationship between PG structure and its function in this symbiosis, with broader implications for understanding innate immunity in higher organisms."
