"AwardNumber","Title","NSFOrganization","Program(s)","StartDate","LastAmendmentDate","PrincipalInvestigator","State","Organization","AwardInstrument","ProgramManager","EndDate","AwardedAmountToDate","Co-PIName(s)","PIEmailAddress","OrganizationStreet","OrganizationCity","OrganizationState","OrganizationZip","OrganizationPhone","NSFDirectorate","ProgramElementCode(s)","ProgramReferenceCode(s)","ARRAAmount","Abstract"
"1600473","Texas-Oklahoma Representations and Automorphic Forms Conference Series","DMS","ALGEBRA,NUMBER THEORY,AND COM","02/01/2016","01/26/2016","Mahdi Asgari","OK","Oklahoma State University","Standard Grant","Janet Striuli","01/31/2019","$13,000.00","Roger Zierau","asgari@math.okstate.edu","401 WHITEHURST HALL","STILLWATER","OK","740781031","4057449995","MPS","126400","7556, 9150","$0.00","This award supports participants in the Texas-Oklahoma Representations and Automorphic Forms (TORA) conference series will take place at the University of North Texas (UNT) in Denton, TX, April 8-10, 2016; at Oklahoma State University (OSU) in Stillwater, OK in Fall 2017; and at the University of Oklahoma (OU) in Norman, OK in Fall 2018.  Each TORA conference will feature three plenary guest speakers consisting of two outstanding leading research mathematicians from outside the Oklahoma-Texas region as well as a recent Ph.D. or a graduate student nearing completion of a Ph.D. In addition, regional graduate students and researchers will present their work. These weekend conferences will provide ample opportunities for collaboration and interactions among the students and researchers in the region, specializing in number theory, automorphic forms and representation theory. <br/><br/>Automorphic forms are basic objects of study in modern number theory.  The interplay between automorphic forms and representation theory has seen a number of very exciting new developments recently which also fuel applications to several other fields. J. Arthur's work on endoscopic classification of representations of the orthogonal and symplectic groups is an example of such new developments.  Research faculty from over a half dozen universities in the Oklahoma and North Texas region work in automorphic forms and representation theory. The TORA conference series has been successful in bringing together researchers from the region and beyond, as well as their students, and propel innovation and exchange. TORA VII-IX will continue this success in collaborations and exchanges not only between institutions, but also among mathematical areas.  The webpage for the 2016 conference can be found here http://www.math.unt.edu/~richter/TORA/TORA7.html."
"1500187","Development and Testing of a Global Quasi-3-D Multi-scale Modeling Framework","AGS","Climate & Large-Scale Dynamics","02/01/2016","01/27/2016","JOON-HEE JUNG","CO","Colorado State University","Standard Grant","Eric DeWeaver","01/31/2020","$656,746.00","David Randall, Celal Konor","jung@atmos.colostate.edu","601 S HOWES ST","FORT COLLINS","CO","805212807","9704916355","GEO","574000","OTHR","$0.00","Global atmospheric general circulation models (GCMs) used for weather prediction and climate modeling typically divide the atmosphere into a grid, with a single value for atmospheric variables like temperature and pressure in each grid box.  As the grid boxes are typically tens of kilometers wide or more it is not possible to represent individual clouds, or even cloud systems, in such models.  Instead the net effect of clouds and other small-scale processes on the larger scale atmospheric flow must be approximated through the use of parameterizations, and this representation is a key source of errors in weather forecasts and uncertainty in future climate change projections. Alternative methods of representing clouds and their interactions with large-scale atmospheric conditions are therefore desirable for forecasting the weather and providing decision support to stakeholders concerned with the impacts of climate variability and change.<br/><br/>This award supports the development and testing of  a novel atmospheric model, the global quasi-3D Multiscale Modeling Framework (Q3D MMF). The model is an extension of the Super-Parameterizaton (SP) scheme developed by the Center for Multiscale Modeling of Atmospheric Processes (CMMAP, see AGS-0425247), the Science and Technology Center (STC).  The SP MMF consists of a global atmospheric general circulation model (GCM) in which the parameterizations for cloud processes and other subgrid-scale processes in each grid column are replaced by a high-resolution cloud resolving model (CRM). CMMAP has already produced an SP version of the Community Atmosphere Model (CAM, or SP-CAM for the SP version). But SP-CAM uses a two-dimensional (2D) CRM in which the domain is a vertical plane oriented in either the zonal (x-) or meridional (y-) direction and periodic boundary conditions in the x- or y-direction. These restrictions are imposed to reduce computational cost, and to relax them entirely would require a global CRM (GCRM) which is too computationally expensive for most purposes. <br/><br/>Alternatively, the Q3D MMF partially relaxes the conditions by using CRMs with domains that are narrow channels with only a few gridpoints in the cross-channel domain. The channels connect with their counterparts in neighboring cells of the GCM, thus avoiding periodic boundary conditions at either end of the channel. Moreover, each grid cell of the GCM has two such channel-shaped CRMs, oriented in the zonal and meridional direction, to allow for directional anisotropy due to surface topography and other factors.The zonal and meridional CRM channels thus extend around the globe without interruption and intersect each other at adjacent grid cells of the parent GCM. The channel models do not interact at the intersections, as that would result in unphysical behavior associated with a cross-shaped domain. The separate CRM channels communicate only with the GCM, receiving background information from the GCM and supplying the GCM with the outputs expected from standard grid column parameterizations found in conventional GCMs.  Work here is an extension of previous work at CMMAP, including the development of a simpler version in which the CRMs are embedded in a regional model over an idealized tropical domain.  Work under this award includes several tasks required to develop a global model from this prototype, including inclusion of topography and conversion from a periodic Cartesian domain to a realistic GCM domain.<br/><br/>The work has broader impacts for the research community because it develops a new atmospheric model which is applicable to a range of research areas related to the impact of clouds on large-scale weather and climate phenomena.  To ensure accessibility to the broader research community, the Q3D MMF will be constructed using a version of CAM (the spectral element version) as the GCM component.  CAM is freely available, well supported and documented, and widely used, thereby maximizing accessibility.  In addition, CAM is the atmospheric component model of the Community Earth System Model, which is used for projections of future climate change that inform decision makers concerned with climate impacts on natural and human systems."
"1561216","EAGER: Fine-Grained Software Power Prediction and Its Application on Power Management of Heterogeneous Multicore Systems","CCF","Software & Hardware Foundation","02/01/2016","01/29/2016","Weisong Shi","MI","Wayne State University","Standard Grant","Almadena Chtchelkanova","07/31/2019","$299,928.00","","weisong@udel.edu","5700 CASS AVE STE 4900","DETROIT","MI","482023692","3135772424","CSE","779800","7916, 7942","$0.00","Power dissipation and energy consumption are major cost considerations across modern computer systems including data center design, enterprise level server design, battery life management on a smart phone, and circuit layout on a microprocessor. There are numerous approaches that address the hardware aspect of the problem. However, software-behavior-driven power management is not well addressed and understood.<br/><br/>SPONGE, a fine-grained function level software power prediction mechanism, is proposed to dynamically apply proper power saving mechanisms to improve power efficiency and schedule suitable workloads to heterogeneous cores. The PI is proposing a new metric, Power Efficiency of Function (PEF), to evaluate the power efficiency of software at fine granularity. Based on PEF, a software-behavior-driven power management scheme is introduced to improve system power efficiency at runtime. The power management scheme applies power saving mechanisms including thread mapping and voltage and frequency scaling, driven by program characteristics based on the software power prediction of the target platform. PEF enables a quantitative measurement of the ratio of useful work done to resources utilized. By involving software in the loop of power management, it is possible to provide a fine-grained power management scheme with a seamless connection between software and operating systems, especially for power-aware scheduling on heterogeneous multicore architectures."
"1552037","CAREER: Sustainable Chemical Synthesis by Plasma-Enhanced Solar Energy","CBET","EchemS-Electrochemical Systems","02/01/2016","07/18/2016","Juan Trelles","MA","University of Massachusetts Lowell","Standard Grant","Carole Read","01/31/2022","$519,121.00","","Juan_Trelles@uml.edu","220 PAWTUCKET ST STE 400","LOWELL","MA","018543573","9789344170","ENG","764400","1045, 146E, 9251","$0.00","The production of fuels and chemicals by sustainable processes is one of key technological challenges of the 21st century.   Carbon dioxide gas generated by power generation or industrial processes is a potential source of carbon for fuels and chemicals production.  However, carbon dioxide is not very reactive, and no viable technologies for its conversion into fuels and chemicals presently exist.  The goal of this product is to convert carbon dioxide and water to fuels and chemical using plasma-enhanced solar energy.  In the proposed process, solar energy heats the carbon dioxide gas to the high temperatures needed to increase its reactivity.  The heated gas is then converted into plasma, also known as an electrically charged gas, using electrical energy.   It is reasoned that the plasma state of the gas will enhance the rate of carbon dioxide conversion.  The process is potentially sustainable and has a low carbon footprint because it uses waste carbon dioxide and abundant solar energy, where electricity needed to generate the plasma is provided by solar photovoltaic cells.  The project will also develop instructional carts for demonstrating energy and sustainability topics inspired by this research to a broad audience that includes Hispanic K-12 students in the Lowell, Massachusetts area.  <br/><br/>The overall goal of the proposed research is to develop a fundamental understanding of a new process for synthesis of chemical and fuels from carbon dioxide and water using concentrated solar energy to drive the reaction thermochemistry and non-equilibrium plasma to enhance the chemical reaction kinetics.   Plasma-Enhanced Solar Energy (PESE) combines solar thermochemistry and plasma science principles.  The project will experimentally and computationally investigate PESE for carbon dioxide, water, and methane decomposition and reforming.  The research will test the hypothesis that the molecular excitation produced by free electrons in plasmas increases solar photon absorption leading to enhanced chemical reaction kinetics.  Towards this end, the proposed research will seek to understand non-equilibrium energy transport phenomena characteristic of free electron and photon systems, with particular focus on processes with comparable photon and electron energy fluxes.  To support the research plan, new reactor systems equipped with solar energy receivers and non-equilibrium electrical discharge capability to flowing gas will be developed and characterized.  Reactor experiments spanning the ratio of solar to electrical energy inputs will be performed at scalable process conditions.  New fluid flow and chemical kinetics models for non-equilibrium energy transport will be derived and experimentally validated.  The research outcomes seek to reveal the specific pathways of energy conversion during PESE processing and quantify the efficacy of plasma enhancement.  Additionally, the research outcomes are relevant to other fields where electron and photon transport have essential roles, such as laser materials processing, semiconductor manufacturing, and combustion enhancement.  The educational goal of the project is to engage students, from middle school to graduate level, on global energy sustainability topics.  To enable the proposed education program, interactive demonstration carts for the modular teaching and learning of energy engineering & sustainability will be developed and assessed."
"1600767","Graduate Student Combinatorics Conference 2016","DMS","Combinatorics","02/01/2016","01/28/2016","Svetlana Poznanovikj","SC","Clemson University","Standard Grant","Jacques Verstraete","01/31/2017","$16,000.00","Matthew Macauley","spoznan@clemson.edu","201 SIKES HALL","CLEMSON","SC","296340001","8646562424","MPS","797000","7556, 9150","$0.00","The 2016 Graduate Student Combinatorics Conference will be held April 1-3, 2016 at Clemson University, Clemson, SC. The main purpose of this conference is to bring together graduate students in combinatorics in order to educate participants about the many areas of combinatorics, provide a venue for sharing current research topics and open questions, have participants meet fellow graduate students from across the country, and provide an opportunity for students to collaborate on current research problems. The conference will feature two plenary one-hour speakers and a number of twenty-minutes contributed talks by graduate students. This will be the 12th annual conference in this series which was started in 2005 at the University of Minnesota. The conference will be publicized via email and information will be posted on a conference website. <br/><br/>The conference provides an opportunity for graduate students to learn about the current research in all areas of combinatorics, including algebraic and enumerative combinatorics, graph theory, design theory, and coding theory. The conference is designed specifically for graduate students and it is organized essentially by the graduate students themselves. Combinatorics faculty from Clemson and the invited speakers will act as mentors for the graduate students throughout the process. The conference promotes recent advances in research and exposition of students' research in a supportive environment."
"1552177","CEDAR: High Speed Spectroscopic Studies of lightning bolts: Starters, Jets, and Gigantic Jets","AGS","AERONOMY","02/01/2016","04/07/2017","Ningyu Liu","FL","Florida Institute of Technology","Continuing Grant","ruth lieberman","10/31/2017","$366,997.00","Hamid Rassoul","Ningyu.Liu@unh.edu","150 W UNIVERSITY BLVD","MELBOURNE","FL","329018995","3216748000","GEO","152100","","$0.00","The Coupling, Energetics, and Dynamics of Atmospheric Regions (CEDAR) program, a broad-based, community-guided, upper atmospheric research program, seeks to understand the behavior of atmospheric regions from the lower atmosphere upward through the ionized upper layers of the atmosphere. Of particular interest is the question of the scale of coupling of the lower atmosphere, where phenomena such as thunderstorms exist, to the ionized layer near 100-120 km. The physics of lightning phenomenology within thunderstorm events are very complex and highly time-dependent with complex morphology characterizing the coupling of lightning bolts to the ionosphere with consequential significant temporal behavior of the ionized density of the lower ionosphere region.  These electrical discharges are initiated inside thunderstorms and are rooted in one of the main thundercloud charge layers. This award would study the physical processes underlying the particular transient lightning bolt structures referred to as blue starters, jets, and gigantic jets, which are the upward electrical discharges from thunderstorms that terminate at 20-30 km, 40-50 km and 70-90 km altitude, respectively.  These are generated suddenly within a fraction of a second from thunderstorms. The research supported by this award would examine the energetics and dynamics of these TIL (Transient Luminous Event) phenomena. Typically, the initial vertical development has a speed of ~100 km/s, but after 100-300 ms, the upward discharge leading to gigantic jets suddenly accelerates to reach the lower ionosphere with a speed greater than 1000 km/s. The funded research would be primarily observational involving the construction of a high-speed (5,000 frames per second) spectrograph that can analyze the energetics of the jets and starters through the fast acquisition of visible atomic and molecular spectra allowing high-speed measurements of the relative intensities of the red-to-blue colors emitted by the lightning bolt along its path between the storm and the ionized layer. Analysis of these spectra would provide the time variations of the vertical temperature profile within the ionized air pathway of the lightning bolt. This information about the temperature profile would be used to quantify the energetics underlying the formation of these morphological features of the lightning bolt.  This award has the potential of transformative research that would provide a major advance in the knowledge and understanding of the physics of transient plasma discharges which should prove to be extremely valuable and of high importance to the study of laboratory electrical discharges and tropospheric lightning investigations; such findings would be of great value to other disciplines such as power transformers, laser fusion research, and plasma discharge systems.  The award would support significant activity in STEM education and student training similar to that recently conducted by the PI and his group.  Finally, this award has a strong potential of attracting public attention via local TV and newspaper interviews.  The grant awardees indicated also that they would provide the public with excellent public access to the research with frequent open lectures that would generate strong interest by the public in lightning phenomena.<br/><br/>The award represents a strong potential for exciting and transformative science. The proposed research would examine in detail fundamental science questions that are related to jet and starter dynamics and their electrical coupling between the lower atmosphere and ionosphere.  Moreover, the proposed observational approach is sophisticated providing critical high-time resolution spectral information on the spectral properties of starters and jets that would be studied to produce height profiles of temperature along the path of the conductive path between the top side of the thunderstorm and the lower ionosphere region established by the lightning bolt."
"1559196","Stratigraphic Paleobiology and Historical Ecology of Po Basin","EAR","Sedimentary Geo & Paleobiology","02/01/2016","09/09/2020","Roger Portell","FL","University of Florida","Standard Grant","Jonathan G Wynn","01/31/2021","$363,329.00","","portell@flmnh.ufl.edu","1523 UNION RD RM 207","GAINESVILLE","FL","326111941","3523923516","GEO","745900","","$0.00","The focus of this project is the geologic history of Po River Delta (Adriatic Sea). Due to changes in sea level that took place over the last 125 thousand years, the Adriatic Sea first contracted and then expanded. Consequently, Po Delta migrated offshore by almost 300 km and then retreated back to its current location. This project will examine how these long-term changes impacted the delta. Documenting how coastal zones responded to past climate shifts is important because coastlines are particularly sensitive to current environmental changes. In the case of Po Plain, its diverse marine life is already in decline and its agricultural wealth is under threat. The local historical cities such as Venice are at risk as well. By using Po Delta as a model example for coastal responses to environmental changes, the project will also serve as a platform for K-12 activities, public outreach, and undergraduate and post-graduate training. The project will result in a public exhibit at the Florida Museum of Natural History and foster international partnership between University of Florida and University of Bologna.<br/><br/>A total of 112 sediment cores drilled under the Adriatic Sea will be used to reconstruct the geologic and ecologic history of Po Delta. The core sediment data will be used to describe the internal architecture of the delta. The cores should also produce ~1000 samples of marine fossils. In addition, geochemical methods will be employed to numerically date 400 mollusk specimens. Multivariate analyses and computer models will be applied to explore the resulting data. These analyses will allow for testing hypotheses regarding the development of river deltas under different climate regimes and long-term responses of marine ecosystems to environmental changes."
"1552556","CAREER:  A continuum model for simultaneous prediction of granular flow and size-segregation in general geometries","CBET","PMP-Particul&MultiphaseProcess","02/01/2016","01/28/2016","David Henann","RI","Brown University","Standard Grant","William Olbricht","01/31/2022","$507,834.00","","David_Henann@brown.edu","1 PROSPECT ST","PROVIDENCE","RI","029129100","4018632777","ENG","141500","1045, 9150","$0.00","CBET - 1552556<br/>PI: Henann, David L.<br/><br/>The goal of this CAREER project is to develop a theoretical model that describes the behavior of flowing granular materials. Granular materials are ubiquitous - they include naturally-occurring materials such as sand, soil, and snow, as well as industrial and agricultural materials such as pharmaceutical pills and capsules, food grains, and catalyst particles. Predicting the behavior of these materials during flow poses special challenges, especially when the granular material consists of particles of different sizes. In this case, the flow causes the particles to segregate according to size, which, in turn, affects the flow of the material as a whole. The theory developed in this project will use nonlocal modeling to describe a representative granular material consisting of particles of two different sizes - called bidisperse. The resulting model will predict the flow behavior of this bidisperse system in several prototype flow geometries, and the results will be compared with corresponding experiments conducted as part of the project. A variety of educational activities are also planned, including the development of new modules illustrating computational methods in solid mechanics. The project will enlist undergraduates to participate in the research, and workshops will be conducted to disseminate results and engage broad technical communities.<br/> <br/>A predictive continuum theory, based on nonlocal modeling, will be developed that simultaneously predicts size segregation and flow in bidisperse dense granular systems composed of spherical particles. Preliminary tests have demonstrated that this approach produces a model that can predict coupled flow fields and segregation patterns. A systematic set of discrete-element calculations will be performed to isolate shear-strain-rate-driven and gravity-driven mechanisms of segregation, which will clarify the two-way coupling between flow and segregation. The model will then be generalized to three-dimensional flows using a continuum thermomechanics approach, and a finite-element implementation of the non-local, coupled theory will be developed. Predictions of the model will be validated by comparing with experiments of bidisperse granular systems in representative flow configurations."
