"AwardNumber","Title","NSFOrganization","Program(s)","StartDate","LastAmendmentDate","PrincipalInvestigator","State","Organization","AwardInstrument","ProgramManager","EndDate","AwardedAmountToDate","Co-PIName(s)","PIEmailAddress","OrganizationStreet","OrganizationCity","OrganizationState","OrganizationZip","OrganizationPhone","NSFDirectorate","ProgramElementCode(s)","ProgramReferenceCode(s)","ARRAAmount","Abstract"
"1557654","Collaborative Research: Genetic and Physiological Mechanisms of Local Climatic Adaptation in a Widespread Perennial Plant Species","IOS","Integrtv Ecological Physiology","02/15/2016","08/23/2017","Patricio Munoz del Valle","FL","University of Florida","Continuing Grant","Irwin Forseth","01/31/2019","$248,210.00","","p.munoz@ufl.edu","1523 UNION RD RM 207","GAINESVILLE","FL","326111941","3523923516","BIO","765700","9150, 9178, 9179","$0.00","Some plant species are able to thrive across a wide range of climates, and the mechanisms by which this occurs are poorly understood.  Characterizing the genetic and physiological basis of local climatic adaptation is especially critical for assessing whether and how plant species, including crops, can persist through periods of environmental change.  Using the widely-adapted species white clover, this project examines the factors that allow this plant to thrive in climates as dramatically different as northern Minnesota and central Florida.  The production of cyanide-containing compounds appears to play a role in this process, particularly for adaptation to heat and drought.  These compounds are also found in several important crop species, and their importance for drought adaptation will be examined in detail for the first time.  Other aspects of natural genetic and physiological variation in climate tolerance will be assessed through field experiments.  The project will provide classroom materials and curricular activities for an ongoing and highly successful inquiry-based educational outreach program developed by the principle investigator, which has already engaged more than 8000 students and 100 teachers nationwide. Students sample and analyze their local clover populations and contribute data to an online database, where they can compare observations with classes from other climates.  Scientific training will be provided to undergraduates, including those from minority backgrounds, as well as two graduate students and two postdoctoral associates.<br/><br/>Adaptation to local environments plays a key role in the ability of plant species to survive and persist through environmental change, yet the genetic and physiological mechanisms that underlie this process are largely unknown. Through work that integrates QTL mapping of fitness traits, candidate gene analyses of two well-characterized biochemical polymorphisms, and physiological assessments of their fitness impacts, the following questions are addressed, using white clover (Trifolium repens) as a study system: 1) What is the genetic architecture of local climatic adaptation?  Specifically, to what extent does it arise through fitness tradeoffs for alternate alleles of individual genes (antagonistic pleiotropy), or through combinations of loci where individual genes provide a fitness benefit in one environment and are selectively neutral in others (conditional neutrality)? 2) What are the physiological mechanisms by which cyanogenic glycosides function in abiotic stress adaptation? 3) What is the role of gene copy number variation (CNVs) in local adaptation?  This work will rigorously test the function of cyanogenic glycosides, which are found in >3,000 plant species including many crops, in abiotic stress adaptation.  CNVs are abundant in the genomes of many taxa, and the project will directly assess their role in local climatic adaptation, which has not previously been done. The project will also engage high school students and teachers nationwide in hands-on, inquiry-based learning through an ongoing and highly successful outreach program based on clover cyanogenesis, and it will provide training for undergraduates, graduate students and postdoctoral associates."
"1546006","Collaborative Research: Reconstructing the Origins of the Colorado River: An Integrative Study of the Miocene-Pliocene Bouse Formation","EAR","Sedimentary Geo & Paleobiology","02/15/2016","01/27/2016","Rebecca Dorsey","OR","University of Oregon Eugene","Standard Grant","Dena Smith-Nufio","01/31/2020","$209,103.00","","rdorsey@uoregon.edu","1776 E 13TH AVE","EUGENE","OR","974031905","5413465131","GEO","745900","","$0.00","Despite nearly a century of study, the conditions that controlled initiation of the mighty Colorado River remain poorly understood and vigorously debated. This project seeks to reconstruct the origins of the Colorado River through multidisciplinary study of the Bouse Formation, a complex sedimentary deposit that accumulated in the lower reaches of the valley during river initiation between ~ 6.0 and 4.5 million years ago. The study benefits from collaborations among university professors and students, state and federal agency scientists, a county museum paleontologist, and a local high school teacher. <br/><br/>The PI's will use integrated datasets to determine if the Bouse Formation formed in a brackish marine estuary or a large inland lake isolated from the ocean, a key distinction for understanding the origins of the river. This study also explores when and how waters of the Colorado River first reached the sea. Hypotheses will be tested through study of stratigraphic architecture, sedimentology, carbonate geochemistry (including C, O, Sr, and S isotopes), and geochronology. Hypothesis tests emphasize cross-correlation of radiogenic and stable isotope data with major and trace-element chemistry in a precise stratigraphic and structural framework. The PI's will run two workshops: one to engage a broad community of geoscientists, and one to plan a future scientific drilling proposal."
"1554265","CAREER: Hybrid Multimode Resonant Switched-Capacitor Converters for Renewable Energy and Point-of-Load Power Delivery","ECCS","EPCN-Energy-Power-Ctrl-Netwrks","02/15/2016","01/21/2016","Jason Stauth","NH","Dartmouth College","Standard Grant","Lawrence Goldberg","01/31/2022","$500,000.00","","jason.t.stauth@dartmouth.edu","7 LEBANON ST","HANOVER","NH","037552170","6036463007","ENG","760700","1045, 155E","$0.00","The field of power electronics is expected to grow in scope and importance in coming decades due to the rising need for renewable energy generation and storage, increasing adoption of electrified transportation, and to broadly reduce energy consumption of end-load applications. This research effort targets circuit, system, and implementation details of new families of power electronics based on resonant and multimode operation of switched-capacitor (SC) families of DC-DC converters. The work holds promise in facilitating greatly increased utilization of high-energy-density passive devices (capacitors and inductors) while leveraging exponential (Moore's Law) semiconductor scaling, and transformational benefits of wide-bandgap transistors. Specific research will address next-generation energy management circuits and architectures for photovoltaic systems, and large-scale battery arrays used in electrified transportation and grid-embedded energy storage. The work will also extend more generally to a variety of applications that demand high power-efficiency in a variety of load conditions, high power-density (small size), low cost, and robust variable regulation capability. Research and teaching are integrated through the training and involvement of Dartmouth graduate and undergraduate students, specific outreach modules that will engage k-12 students and the general public, and teaching activities that integrate research topics and findings in the curriculum.<br/><br/>Resonant or hybrid operation of switched-capacitor (SC) DC-DC converters is growing increasingly attractive as the approach benefits from many of the fundamental advantages SC topologies have compared to more traditional magnetics-based topologies (e.g. buck or boost), but it can eliminate many specific limitations or disadvantages of the SC architecture. In particular, we address key knowledge gaps related to achieving highly-efficient variable voltage regulation by using the native switching capability of SC topologies merged with resonating or soft-charging inductors. We will explore the prospects of merged-multiphase interleaving that have the potential to reduce size and cost, while increasing efficiency and power-density. Variable regulation is essential for most point-of-load applications, but also promising as a way to implement distributed granular maximum power point tracking (MPPT) in photovoltaic systems, and online spectroscopic diagnostic capability in large-scale electrochemical storage systems. We will also explore multi-mode operation to extend high efficiency across a wide load range for a range of circuit topologies spanning moderate-low voltage and higher voltage applications using wide-bandgap devices."
"1545986","Collaborative Research: Reconstructing the Origins of the Colorado River: An Integrative Study of the Miocene-Pliocene Bouse Formation","EAR","Sedimentary Geo & Paleobiology, Integrat & Collab Ed & Rsearch","02/15/2016","05/10/2017","Laura Crossey","NM","University of New Mexico","Standard Grant","Dena Smith-Nufio","01/31/2020","$216,331.00","Karl Karlstrom","lcrossey@unm.edu","1 UNIVERSITY OF NEW MEXICO","ALBUQUERQUE","NM","871310001","5052774186","GEO","745900, 769900","018Z","$0.00","Despite nearly a century of study, the conditions that controlled initiation of the mighty Colorado River remain poorly understood and vigorously debated. This project seeks to reconstruct the origins of the Colorado River through multidisciplinary study of the Bouse Formation, a complex sedimentary deposit that accumulated in the lower reaches of the valley during river initiation between ~ 6.0 and 4.5 million years ago. The study benefits from collaborations among university professors and students, state and federal agency scientists, a county museum paleontologist, and a local high school teacher. <br/><br/>The PI's will use integrated datasets to determine if the Bouse Formation formed in a brackish marine estuary or a large inland lake isolated from the ocean, a key distinction for understanding the origins of the river. This study also explores when and how waters of the Colorado River first reached the sea. Hypotheses will be tested through study of stratigraphic architecture, sedimentology, carbonate geochemistry (including C, O, Sr, and S isotopes), and geochronology. Hypothesis tests emphasize cross-correlation of radiogenic and stable isotope data with major and trace-element chemistry in a precise stratigraphic and structural framework. The PI's will run two workshops: one to engage a broad community of geoscientists, and one to plan a future scientific drilling proposal."
"1556738","Collaborative Research: Effects of Genetic Diversity, Epigenetic Change, and Root-associated Fungal Colonization on Trait Variation in the Foundation plant Spartina alterniflora","IOS","Integrtv Ecological Physiology","02/15/2016","01/22/2016","Randall Hughes","MA","Northeastern University","Standard Grant","Irwin Forseth","01/31/2020","$179,702.00","","rhughes@neu.edu","360 HUNTINGTON AVE","BOSTON","MA","021155005","6173735600","BIO","765700","9178, 9179","$0.00","Issues as diverse as diagnosing human health problems and understanding organismal response to the environment rely on deciphering how DNA sequences are translated into important traits. This project focuses on salt marshes, important coastal habitats that benefit humans by supporting key fisheries and providing protection from large oceanic storms. It takes advantage of novel DNA sequencing approaches to examine how different strains of a critical salt marsh plant react to stressful environmental variation, and how responses to stress may be facilitated by interactions with an understudied stress-tolerant fungus. In addition to benefiting salt marshes, this type of understanding is critical for predicting response to changing environments, managing biodiversity, developing sustainable crops, and improving treatments for disease. The project will support the education and training of students at multiple levels, including undergraduate students from diverse and under-served populations. Additionally, the project will be led by three female investigators, serving as role models for women in science.<br/><br/>This research will examine the relationships among plant genetic and epigenetic diversity, root-associated fungi, and plant structural and physiological trait variation (morphology, nutrient content, salt tolerance) across an inundation gradient in the intertidal foundation plant species Spartina alterniflora. Specifically, the project combines genomic approaches with field surveys and experiments in the greenhouse and the field to address the following questions: (1) How are plant genetic and epigenetic variation, root-associated fungi, and plant structural and physiological traits related across an intertidal gradient?; (2) Does the presence and strain of root-associated fungi affect plant structural and physiological trait response to abiotic variables, and is this effect mediated by epigenetic change?; and (3) How are candidate genes or gene networks involved in the structural and physiological response to the biotic and abiotic environment, and are they epigenetically regulated? The work takes advantage of a novel reduced representation DNA sequencing epiGBS protocol with bisulphite treated DNA to measure genetic and epigenetic diversity in S. alterniflora. Additionally, next generation sequencing of fungal isolates will allow for documentation of the role of dark septate endophytes in the response of this critical foundation species to its dynamic salt marsh habitat."
"1557934","Collaborative Research: Scents of Self: How Trade-offs Shape Self/Non-self Recognition Cues in a Supercolonial Insect","IOS","Symbiosis Infection & Immunity","02/15/2016","02/02/2019","Neil Tsutsui","CA","University of California-Berkeley","Continuing Grant","Mamta Rawat","01/31/2020","$605,477.00","","ntsutsui@berkeley.edu","1608 4TH ST STE 201","BERKELEY","CA","947101749","5106433891","BIO","765600","1228, 9178, 9179","$0.00","Insects live in a world of chemical signals. Chemicals are used as defensive weapons, to signal danger, to mark resources for later foraging or for avoidance, and to identify mates of the correct species and assess their quality. The social insects take this chemically-oriented lifestyle to an extreme. The sophisticated division of labor in social insect colonies requires exquisite regulation of individual behaviors, and chemical pheromones are crucial for organizing work within the colony. Despite these important and diverse roles, we have only a rudimentary understanding of how pheromones originate and evolve. In this project genetic manipulations, pheromone analyses, and behavioral tests will be combined to clarify how various forces of natural selection shape chemical communication in a social insect. This research will be performed using the invasive Argentine ant (Linepithema humile) as a model system. This ant, a globally widespread invader, is considered one of the 100 worst invasive species in the world, and is a significant agricultural and structural pest. The research is likely to reveal pheromonal and behavioral processes that can be targeted in the development of new control techniques, thus contributing to greater ecological resilience, enhanced food quality and security, and reduced degradation of soil and water by conventional insecticides. <br/><br/>Self/non-self recognition systems have played a central role in many of the major evolutionary transitions. Because components of these recognition systems are often co-opted from existing systems, they can experience conflicting forms of selection after acquiring their new functions. The societies of eusocial insects are an ideal system in which to study the evolutionary trade-offs associated with the evolution of self/non-self recognition systems. In many eusocial insects, cuticular hydrocarbons (CHCs) are used to distinguish colony mates (self) from non-colony members (non-self). However, CHCs have also retained their original function as barriers to desiccation. These two distinct roles of CHCs - as both desiccation barriers and recognition pheromones - are expected to produce different forms of selection, as the optimal molecular properties for the two functions are quite different. In this project functional genomics, chemical ecology, and behavioral ecology will be combined to test the overarching hypothesis that evolutionary trade-offs shape the recognition system of social insects. The results of this research will illuminate how genetic and chemical changes lead to changes in individual behavior and, in turn, alter the structure of complex societies."
"1601105","Texas-Oklahoma Representations and Automorphic Forms Conference Series","DMS","ALGEBRA,NUMBER THEORY,AND COM","02/01/2016","01/26/2016","Ameya Pitale","OK","University of Oklahoma Norman Campus","Standard Grant","Janet Striuli","01/31/2019","$13,000.00","Kimball Martin, Ralf Schmidt","apitale@ou.edu","660 PARRINGTON OVAL RM 301","NORMAN","OK","730193003","4053254757","MPS","126400","9150, 7556","$0.00","This award supports participants in the Texas-Oklahoma Representations and Automorphic Forms (TORA) conference series will take place at the University of North Texas (UNT) in Denton, TX, April 8-10, 2016; at Oklahoma State University (OSU) in Stillwater, OK in Fall 2017; and at the University of Oklahoma (OU) in Norman, OK in Fall 2018.  Each TORA conference will feature three plenary guest speakers consisting of two outstanding leading research mathematicians from outside the Oklahoma-Texas region as well as a recent Ph.D. or a graduate student nearing completion of a Ph.D. In addition, regional graduate students and researchers will present their work. These weekend conferences will provide ample opportunities for collaboration and interactions among the students and researchers in the region, specializing in number theory, automorphic forms and representation theory. <br/><br/>Automorphic forms are basic objects of study in modern number theory.  The interplay between automorphic forms and representation theory has seen a number of very exciting new developments recently which also fuel applications to several other fields. J. Arthur's work on endoscopic classification of representations of the orthogonal and symplectic groups is an example of such new developments.  Research faculty from over a half dozen universities in the Oklahoma and North Texas region work in automorphic forms and representation theory. The TORA conference series has been successful in bringing together researchers from the region and beyond, as well as their students, and propel innovation and exchange. TORA VII-IX will continue this success in collaborations and exchanges not only between institutions, but also among mathematical areas.  The webpage for the 2016 conference can be found here http://www.math.unt.edu/~richter/TORA/TORA7.html."
"1558483","Characterizing the contribution of bacteria from the SUP05 clade to autotrophic and heterotrophic carbon cycling across ocean gradients","OCE","BIOLOGICAL OCEANOGRAPHY","02/01/2016","01/25/2016","Robert Morris","WA","University of Washington","Standard Grant","Michael Sieracki","01/31/2021","$845,578.00","Anitra Ingalls","morrisrm@u.washington.edu","4333 BROOKLYN AVE NE","SEATTLE","WA","981951016","2065434043","GEO","165000","8811, 1389, 8242, 9117","$0.00","Life in the ocean is dominated by diverse communities of microorganisms that are fueled by the remains of algae. The relative activity of different microbial community members can determine the extent of greenhouse gas capture, recycling of nutrients and food production by the ocean.  Currently, there is a critical gap in our ability to quantify the balance between these processes.  A major roadblock in our ability to understand the microbial players is our inability to grow even the most abundant organisms in the lab and study their physiology.  With the recent cultivation of three bacteria common to the ocean, the possibility exists to make major advances in our understanding of their contribution to ocean processes and how they might change in the future.  This project will characterize these three bacteria in culture to develop tools to determine their activities in the field.  Because these bacteria are common in low oxygen environments, this work is particularly well poised to address how microbial communities respond to oxygen-depleted waters.  This project will train graduate and undergraduate students in an important research area through collaboration with the University of Washington Integrative Graduate Education and Research Traineeship program, the Program for Climate change and the University of Washington's Educational Outreach Program. Results will be presented at national and international meetings and through publication. All data will be freely available through the Biological and Chemical Oceanographic Data Management Office (BCO-DMO).<br/><br/>The balance between autotrophy and heterotrophy determines the size of the ocean's carbon sink and the flux of material and energy available to food chains. Despite efforts to identify the contributions of major bacterial and archaeal lineages to carbon fluxes, little is known about the environmental conditions that determine the underlying metabolisms controlling carbon flux. Members of the SUP05 clade of sulfur oxidizing gamma-proteobacteria are abundant in the dark ocean and can dominate expanding suboxic and anoxic zones, where they have the potential to both produce and consume organic matter. The recent cultivation of 3 representatives from the SUP05 clade has revealed striking metabolic diversity within the clade. These isolates represent an unprecedented opportunity to elucidate the effects of carbon limitation, energy limitation and oxygen tension on the production and consumption of organic matter by a critical group of marine bacteria. The work proposed here would 1) determine the balance between autotrophic carbon fixation and heterotrophic organic matter assimilation in diverse cultured representatives under varying environmental conditions 2) determine the kinetics of reactions fueling autotrophy 3) characterize biomarkers along gradients of autotrophic and heterotrophic production induced by varying environmental conditions and 4) detect these molecular markers in the field along with cell abundances to determine the contribution of autotrophy, heterotrophy, sulfur oxidation and denitrification to SUP05 metabolism in a field site that transects an oxygen minimum zone in the North Pacific Ocean. This project will advance understanding of SUP05, a biological driver of elemental cycling in the mesopelagic, one of the largest habitats on earth and one that is experiencing large climate driven changes, including expansion of oxygen minimum zones."
"1554243","Fifth International IEEE Conference on Computational Advances in Bio and medical Sciences (ICCABS) - Travel Awards","IIS","Info Integration & Informatics","02/01/2016","01/28/2016","Sanguthevar Rajasekaran","CT","University of Connecticut","Standard Grant","Sylvia Spengler","01/31/2017","$12,000.00","","rajasek@engr.uconn.edu","438 WHITNEY RD EXTENSION UNIT 1133","STORRS","CT","062699018","8604863622","CSE","736400","7556, 7364","$0.00","Advances in high-throughput technologies such as DNA sequencing and mass spectrometry are profoundly transforming life sciences, resulting in the collection of unprecedented amounts of biological and medical data. Using this data to advance our knowledge about fundamental biological processes and improve human health requires novel computational models and advanced analysis algorithms. IEEE ICCABS (International Conference on Computational Advances in Bio and Medical Sciences) aims to bring together leading academic and industry researchers to discuss the latest advances in computational methods for bio and medical sciences.  The award would provide funding for students and junior researchers to participate in this international meeting that covers a range of topics from structure bioinformatics to systems biology and high performance Biocomputing.  The conference proceeding ae made available both online and in special journal publications."
