"AwardNumber","Title","NSFOrganization","Program(s)","StartDate","LastAmendmentDate","PrincipalInvestigator","State","Organization","AwardInstrument","ProgramManager","EndDate","AwardedAmountToDate","Co-PIName(s)","PIEmailAddress","OrganizationStreet","OrganizationCity","OrganizationState","OrganizationZip","OrganizationPhone","NSFDirectorate","ProgramElementCode(s)","ProgramReferenceCode(s)","ARRAAmount","Abstract"
"1554531","CAREER: Development of an Integrated Analytical Framework for Urban Sustainability","CBET","EnvS-Environmtl Sustainability","09/01/2016","01/28/2016","Simi Hoque","MA","University of Massachusetts Amherst","Standard Grant","Bruce Hamilton","05/31/2017","$508,714.00","","sth55@drexel.edu","101 COMMONWEALTH AVE","AMHERST","MA","010039252","4135450698","ENG","764300","1045","$0.00","T1554531 (Hoque)<br/><br/>This CAREER grant is aimed at developing an Integrated Urban Metabolism Analytical Tool (IUMAT) to evaluate and predict the impacts of energy and water use, land use, and transportation systems at an urban scale. IUMAT is designed to systematically quantify aggregate impacts in terms of performance metrics, such as GHG emissions and energy use.The PI will develop new methods and analytical tools for three different modules that operate within the IUMAT framework - Energy & Water, Land Use, and Transportation.<br/><br/>This research will involve compiling and analyzing data from varied sources as well as developing statistical methods to identify the relationships between modules. An interdisciplinary team-based undergraduate course will be developed to evaluate the effectiveness of sustainable urban programs. Students will also have additional research opportunities to evaluate sustainability initiatives in collaboration with UMass Facilities. STEM workshops and internships on urban sustainability will be developed for middle and high school girls through a STEM program called Eureka! The modules will be tested and validated using real world contexts; and the PI will create case studies and develop decision tools that will inform the sustainable planning process. Collaborative partnerships with local planning agencies will be formalized through a Planning Stakeholders Advisory Board that will provide guidance and datasets for evaluating the credibility and usability of IUMAT modules."
"1553661","CAREER: Self-Assembly of Zwitterionic Amphiphilic Copolymers for Membranes with Sharp, Tunable Pore Size","CBET","Interfacial Engineering Progra","09/01/2016","07/09/2019","Ayse Asatekin","MA","Tufts University","Standard Grant","Christina Payne","08/31/2022","$525,846.00","","Ayse.Asatekin@tufts.edu","80 GEORGE ST","MEDFORD","MA","021555519","6176273696","ENG","141700","1045, 9102, CL10","$0.00","CAREER 1553661-Asatekin.<br/><br/>Membrane filtration is energy efficient, simple, scalable, and a key technology for generating clean, safe water and for preventing water pollution. Most commercially available membranes are composed of a handful of polymers, and are limited in the types of separations they can perform. This project aims to build an integrated research and education plan centered on developing novel membranes with new capabilities by designing polymers that self-assemble to form nanostructures. Specifically, this research will focus on controlling the pore size of a novel family of membranes with high flux, exceptional fouling resistance, and sharp size-based selectivity, prepared by coating zwitterion-containing amphiphilic copolymers on porous supports. This research will lead to the development of improved membranes for separations underserved by existing technologies such as peptide separations and textile wastewater treatment. It will create a link between polymer structure and membrane performance that will enable the rational design of membrane materials for specific applications. The research will be fully integrated with a system of educational activities through the involvement of students at multiple stages in developing and performing outreach activities on polymer science and separations. The team will work closely with Tufts Center for Engineering Education and Outreach (CEEO) to develop new outreach activities for K-12 students. The activity ideas will be initiated as term projects in the PI's courses for undergraduate and graduate students. They will be tested in summer workshops for girls in Malden, MA and also implemented in local schools through the Tufts Student Teacher Outreach Mentorship Program (STOMP), and disseminated through the STOMP Network. <br/><br/>This project aims to build an integrated research and education plan centered on designing polymeric materials that self-assemble into functional nanostructures that lead to the desired membrane functionality (e.g. selectivity, fouling resistance), and on discovering fundamental relationships that correlate polymer chemistry and architecture, self-assembled nanostructure, and function in membrane applications. The specific research objective of this project is to understand how the chemical structure and molecular architecture of copolymers with hydrophobic and zwitterionic groups, and their processing methods, affect (1) their self-assembled nanostructure and (2) their performance as membrane materials in selective separations. The team aims to control the pore size of these membranes by varying the polymer architecture and processing, and to develop fundamental structure-property-function relationships that serve as design rules for polymeric membrane materials with tunable, precise and monodispersed pore size. For this purpose, the team will synthesize amphiphilic copolymers that combine hydrophobic and zwitterionic monomers in random, comb and star-block architectures. How these materials self-assemble will be studied by transmission electron microscopy (TEM) and X-ray scattering. Membranes will be made by coating porous supports with these polymers, and the pore size will be determined by filtration experiments. The pore size, permeability and fouling resistance of membranes will be correlated with the self-assembled morphology. The results will be used to compile design rules or a toolkit for the rational design of membrane materials targeted at specific separations that derive their permeability, selectivity and fouling resistance from their self-assembled structure. The research will be fully integrated with several educational, outreach and mentorship activities, such as the development of outreach activities for K-12 students that introduce concepts in polymer science, self-assembly and separations, incorporation of proposed research into undergraduate lab courses and classes, and involvement of undergraduate students in research."
"1554733","CAREER:  Variational Problems on Arbitrary Sets","DMS","ANALYSIS PROGRAM, Division Co-Funding: CAREER","09/01/2016","07/13/2020","Garving Luli","CA","University of California-Davis","Continuing Grant","Marian Bocea","08/31/2022","$480,844.00","","Kluli@math.ucdavis.edu","1850 RESEARCH PARK DR STE 300","DAVIS","CA","956186153","5307547700","MPS","128100, 804800","1045","$0.00","The rapid developments in technology and the widespread use of mobile devices have led to an explosive amount of data whose complexity is such that it becomes very challenging to extract any useful information in a reasonable amount of time and resources. The data are complex in size, dimension, and structure. The technology for rapidly processing such massive amounts of data is still in its infancy. One of the main goals of this project is to take advantage of some recent mathematical advances to develop and implement fast algorithms for fitting data by smooth functions. This could have many practical applications, for example in the design of automated systems that guide airplanes and unmanned aerial vehicles through complex terrains avoiding obstacles of arbitrary shapes. The proposed research carries the hope of advancing obstacle avoidance algorithms -- fast algorithms that can plan an optimal path under various constraints. The project will open new research directions for students and researchers; and it also will enhance our understanding of mathematical theories such as harmonic analysis, differential geometry, partial differential equations, and nonlinear programming.<br/><br/>This 5-year integrated research and education project focuses on solving variational problems with boundary and/or obstacle constraints on arbitrary subsets in Euclidean space. The approach that the PI proposes is unorthodox: Rather than seeking exact minimizers of energy functionals, the PI will look for functions that minimize the energy functionals up to universal constant multiples. In contrast to the conventional approach to solving variational problems, which involves the solution of a partial differential equation, the PI will construct the solutions directly. The ultimate goal is to develop a complete theory revolving around the belief that any variational problem that can be solved using PDE theory can also be dealt with using extension theory. The special problems the PI will focus on are the obstacle problem, which requires the minimizers to lie above a certain barrier; and the Plateau problem, which seeks a surface of least area with prescribed boundary. Solving variational problems using PDE methods often requires the boundary of the set to have some kind of smoothness. In practice, this is a severe limitation. The novelty of the proposed approach is that there is no need to make any assumption on the geometry or the regularity of the set on which the PI prescribes the boundary conditions or constraints."
"1620694","2016 Atmospheric Optics: Aerosols, Visibility, and the Radiative Balance Conference; Jackson Hole, Wyoming; September 27-30, 2016","AGS","Atmospheric Chemistry","09/01/2016","01/21/2016","Stephanie Glyptis","PA","Air & Waste Management Association","Standard Grant","Sylvia Edgerton","02/28/2017","$25,000.00","Richard Tropp, Delbert Eatough","sglyptis@awma.org","600 GRANT ST STE 3290","PITTSBURGH","PA","152192727","4129046006","GEO","152400","7556, 9150","$0.00","This project supports a workshop hosted by the Air & Waste Management Association (A&WMA) entitled 2016 Atmospheric Optics: Aerosols, Visibility, and the Radiative Balance. The objective of the workshop is to provide a technical forum on advances in the scientific understanding of the effects of small particles on urban, regional, continental, and global scale haze and climate. <br/><br/>The conference will take a multipronged approach by encouraging scientific submissions (e.g., related to measurements, modeling, etc.) as well as submissions addressing regulatory and policy issues. Key sessions include one on black and brown carbon, since recent research has shown the importance of these particles for radiative forcing, and sessions related to the synergistic and increasing concerns of the effects of atmospheric nitrogen and carbonaceous material on haze, climate change, and nitrogen deposition on ecosystems. This NSF project supports the registration, travel, and lodging expenses for graduate students, postdoctoral researchers, and junior faculty from universities and research institutes within the U.S.A. who would otherwise be unable to attend."
"1601239","Southeastern Number Theory Meetings","DMS","ALGEBRA,NUMBER THEORY,AND COM","08/01/2016","01/22/2016","Matthew Boylan","SC","University of South Carolina at Columbia","Standard Grant","James Matthew Douglass","07/31/2018","$14,695.00","Michael Filaseta, Hui Xue, Frank Thorne, James Brown","boylan@math.sc.edu","1600 HAMPTON ST","COLUMBIA","SC","292083403","8037777093","MPS","126400","7556, 9150","$0.00","In mid-September of 2016, the first of three Southeastern Number Theory Meetings planned for the 2016-2017 academic year will be held at either the University of North Carolina at Greensboro in Greensboro, NC, or at Wofford College in Spartanburg, SC.  The University of South Carolina in Columbia, SC will host the second meeting on the first weekend of December 2016.  The third meeting will be held in April 2017 at either the University of North Florida in Jacksonville, FL, or at Washington and Lee University in Lewisburg, VA.  Further information on these meetings including the locations, dates, lists of speakers, lists of participants, and registration information will be linked to the conference home pages (below) as it becomes available.<br/><br/>The conferences slated for 2016 will be the 26th and 27th meetings of the Palmetto Number Theory Series http://www.math.sc.edu/~boylan/seminars/pantshome.html , which is a series of meetings started in 2006 and managed jointly by the University of South Carolina and Clemson University, the two flagship research institutions in South Carolina, the Palmetto State.  The Spring 2017 meeting will be the 30th meeting of the Southeast Regional Meeting on Numbers http://www.math.clemson.edu/~kevja/SERMON/, which is a larger regional meeting started in 1988.  Recent meetings have averaged 40 - 60 participants.  The meetings consist of participant talks on current research in all areas of number theory, including analytic number theory, arithmetic geometry, and automorphic and modular forms. These topics reflect the research interests of number theorists working in the Southeast.   Each meeting features plenary talks by nationally and internationally recognized leaders in the field, invited talks by graduate students and postdoctoral researchers, and a larger number of contributed talks by mathematicians at all levels including undergraduate and graduate students, and junior and senior faculty.  Number theorists from outside the Southeast will give the invited and plenary talks, while regional researchers will give most of the contributed talks.     <br/><br/>A primary goal of the Southeastern Number Theory Meetings is to provide members of the number theory community in the Southeast with an opportunity to learn about new and significant research in number theory and to disseminate their own research.  Students and junior researchers in the community particularly benefit from the meetings. The meetings strengthen their knowledge base, expose their work to a wider audience, and give them insightful input and feedback from other participants.  Funding from the NSF allows the organizers to achieve their goals at a low cost to individual participants.  These meetings integrate regional mathematicians into the community who may have little or no funds for professional travel such as graduate students and faculty at institutions that do not award Ph.Ds.  The organizers will continue efforts to attract a demographically diverse participant base including women and racial and ethnic minorities."
"1554794","CAREER:   Unifying approaches to non-uniform hyperbolicity","DMS","OFFICE OF MULTIDISCIPLINARY AC, ANALYSIS PROGRAM, Division Co-Funding: CAREER","08/01/2016","05/19/2021","Vaughn Climenhaga","TX","University of Houston","Continuing Grant","Marian Bocea","07/31/2023","$624,683.00","","climenha@math.uh.edu","4300 MARTIN LUTHER KING BLVD","HOUSTON","TX","772043067","7137435773","MPS","125300, 128100, 804800","102Z, 1045, 1515","$0.00","There are many phenomena in the real world that we perceive as having random, unpredictable behavior, despite the fact that they follow underlying rules that are completely deterministic and well understood.  For example, when we roll a pair of dice, they fly and bounce according to physical laws that are non-random, but the outcome of the roll is nevertheless random.  A more sophisticated example is weather; although we understand atmospheric dynamics and can make reliable short-term predictions, the exact behavior of the weather several weeks from now remains largely random and unpredictable.  The theory of hyperbolic dynamical systems studies the mechanism that drives this evolution from predictability to randomness.  When this mechanism operates consistently no matter what state the system is in, the system is said to be ""uniformly hyperbolic"".  Such systems are well-understood, but this uniformity condition is so restrictive that it rarely applies to physically realistic examples.  A more realistic condition is ""non-uniform hyperbolicity"", where the increase in randomness only happens some of the time, but nevertheless appears eventually for typical initial conditions.  Several different approaches have been used to study non-uniformly hyperbolic systems, each with its own advantages and disadvantages.  The goal of this project is to develop a unified theory of non-uniform hyperbolicity by clarifying and strengthening the connections between these existing approaches; by introducing new tools; and by studying new classes of examples.<br/><br/>Historically, the two most successful approaches to non-uniform hyperbolicity are Pesin theory (introduced in 1976) and Young towers (introduced in 1998).  Recent work by the PI and his co-authors has introduced ""effective hyperbolicity"" and ""non-uniform specification"".  All four approaches study non-uniform hyperbolicity via invariant measures, but the connections between them are not yet clear, and different approaches have different applications.  For example, Pesin theory gives powerful results once an appropriate invariant measure has been selected, but the other three approaches are more useful for finding distinguished invariant measures such as SRB measures and equilibrium states.  Similarly, Young towers yield stronger statistical properties than the other approaches, but construction of a tower may be quite difficult.  Recently Sarig gave a construction of countable Markov partitions using Pesin theory, which allows a tower to be built for any hyperbolic measure, but gives no information on the rate of decay of the tail of the tower, which is necessary for statistical properties such as the central limit theorem.  Preliminary results by the PI and his co-authors give an alternate construction that yields estimates on the decay rate; the PI will develop this approach to obtain strong statistical properties for a broad class of hyperbolic measures, including the SRB measures constructed using effective hyperbolicity and the equilibrium states constructed using non-uniform specification.  As a first concrete example, geodesic flow in non-positive curvature will be considered; these techniques are expected to give rapid decay of correlations for the unique measure of maximal entropy and other equilibrium states, and to give polynomial decay of correlations for the regular component of Liouville measure (subject to geometric conditions on the manifold).  More generally, the connection between the four approaches will significantly strengthen the tools of effective hyperbolicity and non-uniform specification; it will also make the the powerful theory of Young towers easier to apply, and give a precise sense in which all four approaches are equivalent.  A longer-term goal is to extend the class of rigorously understood non-uniformly hyperbolic examples; one important planned application is to Teichmuller flow, which has deep geometrical significance."
"1554609","CAREER: Backscattering, Confinement and Superconductivity in a Two-Dimensional Topological Insulator","DMR","CONDENSED MATTER PHYSICS","07/01/2016","05/19/2020","Vlad Pribiag","MN","University of Minnesota-Twin Cities","Continuing Grant","Tomasz Durakiewicz","06/30/2022","$642,893.00","","vpribiag@umn.edu","2221 UNIVERSITY AVE SE STE 100","MINNEAPOLIS","MN","554143074","6126245599","MPS","171000","8091, 1045, 7203","$0.00","Non-Technical: The smaller and smaller scales of conventional computer circuits are rapidly approaching dimensions at which quantum mechanical phenomena become unavoidable. At these scales it will be paramount to understand how to harness these quantum effects in order to build more powerful computers. Recently, a new class of materials with unique properties has been discovered, which could play an important role for future information processing technologies. These ""topological insulators"" are electrically insulating in the bulk, but can conduct charge along their boundaries. This CAREER project studies the electronic properties of InAs/GaSb, a two-dimensional topological insulator (2D TI), a material in which electrons flow through edge channels. This project will first shed light on the effects of impurities on the electrical resistance of these edge channels and determine the role of magnetic interactions on charge flow. Furthermore, recent theoretical work has predicted that a 2D TI placed in contact with a superconductor (a metal which conducts charge without energy losses) can host Majorana states. These novel quantum mechanical states could have a transformative impact on fault-tolerant quantum computing. A second objective of this project is therefore to realize and detect Majorana states in a 2D TI-superconductor device. Beyond training graduate and undergraduate students for future careers in science and the high-technology industry, the principal investigator (PI) will promote broader interest in quantum physics, nanoscience and their applications through activities at local science museums and social media. A central educational goal is to increase the Native-American student participation in physics and STEM by launching an internship in the PI's lab and helping to organize a series of annual week-long summer camps for Native-American high-school students and their teachers at the University of Minnesota. <br/><br/>Technical: This project studies backscattering, confinement, topological superconductivity, and Majorana states in InAs/GaSb double quantum wells, a two-dimensional topological insulator (2D TI). Understanding backscattering and confinement of 2D TI helical edge modes is a significant open problem in condensed matter physics, and is important for applications that would harness spin-polarized ballistic transport. The research team uses induced quantum dots to simulate charge and spin impurities, which have been theorized to affect backscattering. Nanoscale magnetic insulator barriers are investigated as a means of confining the edge modes using magnetic exchange coupling. 2D TIs are also ideal systems for realizing topological superconductivity and for observing and manipulating Majorana zero-energy modes. Majorana modes have been predicted to exhibit non-Abelian, anyonic exchange statistics, and could play a key role for the development of decoherence-protected topological quantum bits. One of the main objectives of this project is therefore to realize and detect topological superconductivity and Majorana modes. To this end, the research team will investigate hybrid devices made by contacting InAs/GaSb with conventional superconductors. The research project is closely integrated with an extensive educational plan to train graduate and undergraduate students for successful careers in science and the high-technology industry and help educate the broader public about nanoscience. A central goal is to increase Native-American student participation in physics and STEM disciplines."
"1553301","CAREER: Sustainable Censorship Resistance Systems for the Next Decade","CNS","Secure &Trustworthy Cyberspace","07/01/2016","09/16/2019","Amir Houmansadr","MA","University of Massachusetts Amherst","Continuing Grant","Phillip Regalia","06/30/2022","$589,458.00","","amir@cs.umass.edu","101 COMMONWEALTH AVE","AMHERST","MA","010039252","4135450698","CSE","806000","025Z, 1045, 7434, 9178, 9251","$0.00","The Internet enables people around the world to communicate, fostering free speech,  a free press, and democracy.  For billions of people, however, the freedom to communicate via the Internet is regulated, monitored and restricted by governments or corporations.  To combat such censorship, researchers have designed and deployed a variety of censorship circumvention systems. Unfortunately, such systems have been designed based on ad hoc heuristics (rather than on solid, theoretical foundations) and can be defeated by typical state-level censors. This research project is developing theory, methodologies, and tools to formally design, evaluate, and compare censorship resistance systems. <br/><br/>The researchers are developing a formal model for the Internet censorship problem based on theoretical foundations. In particular, they are deriving a standard set of metrics for modeling the parties involved in each Internet censorship scenario,  and leverage game theory, network science, and information theory for the analysis of specific censorship resistance systems. An important part of this project is the design and deployment of effective censorship resistance systems that will provide reliable, sustainable censorship resistance to Internet users. One approach being targeted by the researchers is leveraging emerging communication paradigms such as content caching, mobility, and cloud computing in the design of censorship circumvention tools. The second approach targeted by the researchers is adapting the design of circumvention systems to the architectural evolutions of the Internet. Specifically, the researchers are investigating the impacts of software-defined networking (SDN) and network functions virtualization (NFV) on Internet censorship and adapting the design of circumvention systems to ensure sustainable circumvention performance for the future."
